Symbol,Price,Beta,VolAvg,MktCap,LastDiv,Range,Changes,companyName,currency,cik,isin,cusip,exchange,exchangeShortName,industry,website,description,CEO,sector,country,fullTimeEmployees,phone,address,city,state,zip,DCF_diff,DCF,image,ipoDate,defaultImage,isEtf,isActivelyTrading,isFund,isAdr
ENGCON-B.ST,77.45,0.0,82499,11755980135,0.84,57.05-106.9,-0.25,engcon AB (publ),SEK,,,,Stockholm Stock Exchange,STO,Farm & Heavy Construction Machinery,https://www.engcongroup.com,"engcon AB (publ) manufactures and sells tiltrotators. It offers quick couplers; EC-oil, which reduces the oil spillage and the time for changing equipment; control and safety systems comprise Q-Safe control locking system that standardizes the use of quick couplers; MIG2 joystick, which enables end-users to customize the joystick's functions; control system DC2, which is used to control the tiltrotators and the excavator's ground movements and boom swing; locking systems; positioning systems; and warning light and sound modules. The company also offers hydraulic tools, such as pallet forks, timber and combi grabs, ground compactors, sweeper rollers, Stone and sorting grabs, and detachable grippers and sweepers; and mechanical tools, including grading beams, tarmac cutters, deep-digging buckets, pallet forks, cable and grading buckets, rippers, water/sewerage buckets, and riddle buckets. It operates in Sweden, Denmark, Norway, Finland, North and South America, Japan, South Korea, Australia, New Zealand, and internationally. The company's products have applications in pipelines, road works, water and sewerage work, railway constructions, electrical works, and telecom and broadband works, as well as work on construction sites and landscaping. engcon AB (publ) was founded in 1990 and is headquartered in Strömsund, Sweden.",Krister  Blomgren,Industrials,SE,400.0,46 67 01 78 00,Godsgatan 6,Strömsund,,833 36,,0.0,https://financialmodelingprep.com/image-stock/ENGCON-B.ST.png,2022-06-17,False,False,True,False,False
BALD-B.ST,48.99,1.068139,2858714,56534459412,5.027778,35.47-70.39,-0.15,Fastighets AB Balder (publ),SEK,,SE0017832488,,Stockholm Stock Exchange,STO,Real Estate—Diversified,https://www.balder.se,"Fastighets AB Balder (publ) develops, owns, and manages residential and commercial properties in Sweden, Denmark, Finland, Norway, Germany, and the United Kingdom. The company's property portfolio comprises apartments, offices, rooms or working spaces, retail spaces, restaurants or cafés, industrial spaces, warehouses, and storage spaces, as well as garages and parking spaces. As of December 31, 2021, it owned 1,678 investment properties with a lettable area of 5,509 thousand square meters. The company was incorporated in 1995 and is headquartered in Gothenburg, Sweden.",Mr. Erik  Selin B.Sc. (Econ.),Real Estate,SE,1161.0,46 31 10 95 70,Parkgatan 49,Gothenburg,,400 15,,0.0,https://financialmodelingprep.com/image-stock/BALD-B.ST.png,2000-01-03,False,False,True,False,False
OMASP.HE,22.1,0.761188,15546,733143190,0.4,16.88-22.2,0.25,Oma Säästöpankki Oyj,EUR,,FI4000306733,,Helsinki,HEL,Banks—Regional,https://www.omasp.fi,"Oma Säästöpankki Oyj, a savings bank, provides banking services to private customers, small and medium-sized enterprises, and agriculture and forestry entrepreneurs in Finland. The company offers accounts; cards mortgage, car, renovation, student, business, and other loans, as well as guarantee facilities; savings and investment products; and asset management, payment, insurance, brokerage, and legal and other advisory services, as well as mobile and online banking services. It operates 32 branches. The company was founded in 2009 and is headquartered in Lappeenranta, Finland.","Mr. Pasi  Sydänlammi M.B.A., M.Sc.",Financial Services,FI,371.0,358 2076 40600,Valtakatu 32,Lappeenranta,,53100,,0.0,https://financialmodelingprep.com/image-stock/OMASP.HE.png,2018-11-30,False,False,True,False,False
ALIG.ST,76.5,1.391988,93243,8172495000,1.82,59.0-102.0,-0.1,Alimak Group AB (publ),SEK,,SE0007158910,,Stockholm Stock Exchange,STO,Specialty Industrial Machinery,https://www.alimakgroup.com,"Alimak Group AB (publ) provides vertical access solutions in Europe, Asia, Australia, South and North America, and internationally. The company operates through four segments: BMU, Construction, Industrial, and Wind. The company develops, manufactures, sells, services, and rents construction hoists and platforms for temporary use in construction and renovation projects; sells used construction products; and provides assembly, disassembly, maintenance, operating assistance, transportation, and insurance services. It also offers installed rack-and-pinion and traction elevators used in ports, power, cement, marine, and oil and gas segments for maintenance and accessibility; service solutions, such as package, preventive maintenance and repair, inspection, refurbishment, and customer training services, as well as genuine replacement parts; and permanently installed equipment and systems that enable regular access to the building maintenance units. In addition, the company provides vertical access solutions and safety products; and service lifts, vertical ladders, and fall protection systems. It offers its products and services under the Alimak, CoxGomyl, Manntech, Avanti, and Alimak Service brand names. Alimak Group AB (publ) was founded in 1948 and is headquartered in Stockholm, Sweden.",Mr. Ole Kristian Jodahl,Industrials,SE,3100.0,46 84 02 14 40,Blekholmstorget 30,Stockholm,,111 64,,0.0,https://financialmodelingprep.com/image-stock/ALIG.ST.png,2015-06-17,False,False,True,False,False
ALLEI.ST,46.28,0.0,602435,11591613130,1.4,33.7-58.42,0.59,Alleima AB (publ),SEK,,,,Stockholm Stock Exchange,STO,Steel,https://www.alleima.com,"Alleima AB (publ) develops, manufactures, and supplies value-added products in stainless steels and special alloys, and products for industrial heating worldwide. It offers tubular products, bars and billets, heating material and technology products, strip steels, medical wires, and coated strip steels. The company provides products to various customer segments, which include seamless stainless tubes, industrial heating elements, wire for medical devices, and precision strip steels. It also offers electrical heating solutions, resistance materials, and medical wire. The company was founded in 1862 and is headquartered in Sandviken, Sweden.",Mr. Goran  Bjorkman,Basic Materials,SE,5886.0,46 2 64 26 00 00,Storgatan 2,Sandviken,,811 34,,0.0,https://financialmodelingprep.com/image-stock/ALLEI.ST.jpg,2022-08-31,False,False,True,False,False
VOLV-B.ST,230.45,1.130662,3163975,471678158483,7.0,154.24-233.85,-1.6,AB Volvo (publ),SEK,,,,Stockholm Stock Exchange,STO,Farm & Heavy Construction Machinery,https://www.volvogroup.com,"AB Volvo (publ), together with its subsidiaries, manufactures and sells trucks, buses, construction equipment, and marine and industrial engines in Europe, North America, South America, Asia, Africa, and Oceania. The company offers trucks for long-haulage, construction, mining, and distribution purposes under the Volvo, UD Trucks, Renault Trucks, Mack, Eicher, Arquus, cellcentric, and Dongfeng Trucks brands; and city and intercity buses, coaches, and bus chassis, as well as associated transport systems under the Prevost and Nova Bus brands. It also provides construction equipment, including excavators, articulated and rigid haulers, wheel loaders, road construction machines, pavers, and compactors under the brand names of Volvo, and SDLG Trucks. In addition, the company offers engines and power solutions for leisure and commercial vessels, as well as for power generation, industrial, and off-road applications under the Volvo Penta brand name. Further, it provides financing, insurance, rental, spare parts, repair, preventive maintenance, service agreement, and assistance services. The company offers its products and services through a network of dealerships and workshops. It has a strategic alliance with Isuzu Motors within commercial vehicles; a partnership with Samsung SDI Co to develop battery packs for its trucks; and an agreement with NVIDIA and Aurora to develop autonomous trucks. AB Volvo (publ) was incorporated in 1915 and is headquartered in Gothenburg, Sweden.",Mr. Martin  Lundstedt M.Sc.,Industrials,SE,86990.0,46 31 66 00 00,GropegArdsgatan 2,Gothenburg,,417 15,,0.0,https://financialmodelingprep.com/image-stock/VOLV-B.ST.png,2000-01-03,False,False,True,False,False
TOBII.ST,19.11,1.459378,243033,2185247725,0.0,15.55-27.8,-0.24,Tobii AB (publ),SEK,,SE0002591420,,Stockholm Stock Exchange,STO,Computer Hardware,https://www.tobii.com,"Tobii AB (publ) develops and sells eye-tracking technology and solutions in Sweden, rest of Europe, the United States, Canada, Asia/Oceania, and internationally. It operates in two segments, Products & Solutions, and Integrations. The Products & solutions segments provides a suite of eye tracking hardware, which includes the Tobii Pro Glasses 3; research-grade and screen-based eye trackers, such as Pro Spectrum and Pro Fusion; and the Tobii Eye Tracker 5, a gaming eye tracker. This segment also includes software Tobii Pro Lab, Sticky, and the consultancy service Tobii Pro Insight. The Integration segment offers algorithms, software, hardware components, system reference designs, and IP-licenses to provide tailored solutions to address industry-specific problems. It serves the scientific studies and research, healthcare, assistive devices, education and training, gaming, extended reality, automotive, and other sectors. The company offers its products through resellers, agents, and distributors. Tobii AB (publ) was founded in 2001 and is headquartered in Danderyd, Sweden.",Mr. Anand  Srivatsa,Technology,SE,533.0,46 86 63 69 90,Karlsrovägen 2D,Danderyd,,182 53,,0.0,https://financialmodelingprep.com/image-stock/TOBII.ST.png,2015-04-24,False,False,True,False,False
SEB-A.ST,126.95,0.834518,3254242,262769990406,6.75,101.15-133.5,-0.6,Skandinaviska Enskilda Banken AB (publ),SEK,,SE0000148884,,Stockholm Stock Exchange,STO,Banks—Regional,https://sebgroup.com,"Skandinaviska Enskilda Banken AB (publ) provides corporate, retail, investment, and private banking services. It operates through Large Corporates & Financial Institutions, Corporate & Private Customers, Baltic, Life, and Investment Management divisions. The company offers research and strategy services; analysis, advisory, execution, and trading services in the foreign exchange, fixed income, equities, and commodities markets; transaction services, including cash management, trade and supply chain finance, and business services; and investor services. It also provides investment banking services, such as corporate finance advisory services related to acquisitions, divestments, and mergers; equity capital market services related to initial public offerings, rights issues, and placings; debt transaction services comprising bonds, corporate acquisition financing, and general corporate refinancing services; leveraged and structured finance services, as well as real estate and shipping finance services. In addition, the company offers venture capital for entrepreneurs and innovators; asset management products that include equities, fixed income securities, hedge funds, commodities, and private equity solutions; and pensions, life insurance, health care insurance, and disability insurance. It serves large corporations and financial institutions, private customers, and small and medium-sized corporates. The company offers its services through 156 branch offices. It operates in Sweden, Norway, Denmark, Finland, Estonia, Latvia, Lithuania, Germany, the United Kingdom, the United States, Ireland, Luxembourg, China, Singapore, Russia, Poland, Hong Kong, Ukraine, and internationally. The company was founded in 1856 and is headquartered in Stockholm, Sweden.",Mr. Johan  Torgeby,Financial Services,SE,16500.0,46 7 71 62 10 00,Kungsträdgårdsgatan 8,Stockholm,,106 40,,0.0,https://financialmodelingprep.com/image-stock/SEB-A.ST.png,2000-01-03,False,False,True,False,False
MAV.ST,0.0101,0.855859,9880448,17114854,0.0,0.009-0.0594,0.0001,Mavshack AB (publ),SEK,,SE0005992419,,Stockholm Stock Exchange,STO,Entertainment,https://www.mavshack.se,"Mavshack AB (publ), together with its subsidiaries, engages in the digital entertainment business in Sweden and internationally. The company offers encryption and transcoding services to customize streaming solutions; subscription-based streaming video on demand services for Asian entertainment content, including live-sport, movies, TV-shows, and audiobooks; and personal IT-consultancy advisory services, including applications, Websites, business systems, and digital infrastructure. It is also involved in the animation and, audio- and video production; and post-production, sound production, live event, augmented reality, and content distribution businesses. The company was formerly known as 24h Technologies AB and changed its name to Mavshack AB (publ) in April 2013. Mavshack AB (publ) was founded in 2007 and is headquartered in Stockholm, Sweden.",Mr. Anand  Jhingan,Communication Services,SE,45.0,46 8 12 45 17 90,KarlavAegen 58,Stockholm,,114 49,,0.0,https://financialmodelingprep.com/image-stock/MAV.ST.png,2013-04-29,False,False,True,False,False
LUND-B.ST,463.3,0.668663,153031,114898397220,4.0,392.8-510.8,-0.5,L E Lundbergföretagen AB (publ),SEK,,SE0000108847,,Stockholm Stock Exchange,STO,Asset Management,https://www.lundbergforetagen.se,"L E Lundbergföretagen AB (publ) manufactures and sells paperboard, paper, and sawn wood products in Sweden and internationally. It operates through Lundberg's Real Estate Operations, Lundberg's Asset Management, Hufvudstaden, and Holmen segments. The company is also involved in the forest and power operations; and equity management, including securities trading. In addition, it owns and manages commercial office, and retail properties. L E Lundbergföretagen AB (publ) was founded in 1944 and is headquartered in Stockholm, Sweden.","Dr. Fredrik  Lundberg B.Sc. (Econ.), D.Econ, D.Tech., Ho, MBA, MSc. Eng.",Financial Services,SE,4090.0,46 84 63 06 00,Hovslagargatan 5B,Stockholm,,104 40,,0.0,https://financialmodelingprep.com/image-stock/LUND-B.ST.png,2000-01-03,False,False,True,False,False
SCA-B.ST,140.3,0.525645,1492799,98573514634,2.5,127.25-163.3,0.5,Svenska Cellulosa Aktiebolaget SCA (publ),SEK,,SE0000112724,,Stockholm Stock Exchange,STO,Lumber & Wood Production,https://www.sca.com,"Svenska Cellulosa Aktiebolaget SCA (publ), a forest products company, develops, produces, and sells forest, wood, pulp, and containerboard products. The company offers various wood products, industrial components, standard wood products, and raw materials, as well as logistic, warehouse, and IT solutions for the wood industry. It also provides pulp products under the Pure, Star, and Cirrus names; and Kraftliner products for consumer durables, electronics, hazardous goods, industrial products, fruit and vegetables, frozen foods, etc. In addition, the company offers forwarding services for various transport modes, such as truck, rail, and barge, as well as marine and road and rail transport; terminal services; and liquid and solid biofuels, pellets, stall pellets, and wind energy. Further, it engages in the processing and distribution of wood products; production of Kraft and chemical thermomechanical pulps, and containerboards; and generation of energy from wind power projects, biomass, and by-products. The company has operation in Sweden, the United States, the United Kingdom, Germany, rest of Europe, Asia, and internationally. Svenska Cellulosa Aktiebolaget SCA (publ) was founded in 1929 and is headquartered in Sundsvall, Sweden.","Mr. Ulf  Larsson B.Sc., BSc Forestry",Basic Materials,SE,3300.0,46 60 19 30 00,Skepparplatsen 1,Sundsvall,,851 88,,0.0,https://financialmodelingprep.com/image-stock/SCA-B.ST.png,2000-01-03,False,False,True,False,False
SPEQT.ST,16.48,1.008429,146394,399033536,6.83,9.35-30.75,0.06,Speqta AB (publ),SEK,,SE0017937279,,Stockholm Stock Exchange,STO,Internet Content & Information,https://speqta.com,"Speqta AB (publ) develops and operates performance-based lead generating platform. The company operates in two segments: Speqta AdTech and Speqta Content & Comparison. It offers Bidbrain, an AI-based SaaS service for e-retailers; Shopello, an e-commerce platform that promotes various online stores products; Vinklubben Food and Beverage that includes sites, such as myTaste, Matklubben, and Vinklubben; and Rahalaitos, a comparison service broker for private and corporate loans. The company also provides shopping-related comparison services, such as OutletSverige and Kampanjjakt.se; and discount codes, games, credit cards, credits, and electricity contracts comparison services under the Expressen, Nettavisen, Aller media/Dagbladet, and Sanoma/Ilta-Sanomat names. In addition, it operates Lanakuten.com and Låne-penger.com for private loan comparison services. The company was founded in 2003 and is based in Stockholm, Sweden.",Ms. Malin  Blomberg,Communication Services,SE,26.0,,Kungsgatan 64,Stockholm,,111 22,,0.0,https://financialmodelingprep.com/image-stock/SPEQT.ST.png,2011-12-30,False,False,True,False,False
INVE-A.ST,214.1,0.78435,613655,659674164258,4.4,165.35-227.0,0.4,Investor AB (publ),SEK,,SE0000107401,,Stockholm Stock Exchange,STO,Asset Management,https://www.investorab.com,"Investor AB (publ) is a venture capital firm specializing in mature, middle market, buyouts and growth capital investments. It is operating through four business areas including core, private equity, operating, and financial investments. For core investments, the firm invests in health care, financial services, IT and fintech sectors and considers investments in listed companies in leading minority positions. The firm seeks to invest globally and acquire a board seat. For its operating investments, the firm seeks to focus on medium-sized to large companies headquartered in Northern Europe. It acquires controlling interest or minority position with significant influence in its portfolio companies within operating investments. The firm considers majority or minority investments in both listed and unlisted companies. Within private equity, the firm makes venture capital and buyout investments. For venture capital, it seeks investments through its subsidiary, Investor Growth Capital, which is focused on investments in the information technology, technology, engineering, financial services, and healthcare sectors in Europe, the United States, and Asia. It seeks to invest in companies ranging from startups to companies that are about to enter an expansion stage and its investment commitment range between SEK 20 million ($2.94 million) and SEK 200 million ($29.43 million). In its venture capital investments, it acquires minority stakes in its portfolio companies and the ownership horizon varies from three to seven years. For buyouts, the firm makes fund investments through its subsidiary, EQT that makes buyout investments in medium-sized mature companies in Northern Europe and Greater China. The firm seeks to exit its private equity investments between three years and seven years. The firm seeks to take board membership in its portfolio companies. For financial investments, it acquires minority ownership in financial holdings for shorter horizon. Investor AB (publ) was founded in 1916 and is based in Stockholm, Sweden with additional offices in Amsterdam, Netherlands; Beijing, China; Menlo Park, California; Hong Kong, China; New York, New York; and Tokyo, Japan.",Mr. Johan  Forssell M.Sc.,Financial Services,SE,18224.0,46 8 61 42 000,Arsenalsgatan 8C,Stockholm,,103 32,,0.0,https://financialmodelingprep.com/image-stock/INVE-A.ST.png,2000-01-03,False,False,True,False,False
ISOFOL.ST,0.65,1.558015,706735,104984755,0.0,0.48-8.86,-0.012,Isofol Medical AB (publ),SEK,,SE0009581051,,Stockholm Stock Exchange,STO,Biotechnology,https://isofolmedical.com,"Isofol Medical AB (publ), a clinical stage biotech company, develops, commercializes, and sells oncology drugs in Sweden and internationally. The company develops arfolitixorin, which is in phase 3 clinical trial for the treatment of advanced colorectal cancer. It has strategic collaborations with Recipharm, Merck & Cie, and Sahlgrenska University Hospital. The company was incorporated in 2008 and is headquartered in Gothenburg, Sweden.","Dr. Roger  Tell M.D., Ph.D.",Healthcare,SE,13.0,46 3 17 97 22 80,Biotech Center,Gothenburg,,413 46,,0.0,https://financialmodelingprep.com/image-stock/ISOFOL.ST.png,2017-04-04,False,False,True,False,False
SECT-B.ST,167.7,1.137027,136253,32310257409,1.0,113.7-207.8,-0.9,Sectra AB (publ),SEK,,,,Stockholm Stock Exchange,STO,Medical Devices,https://sectra.com,"Sectra AB (publ) provides solutions for medical IT and cybersecurity sectors in Sweden, the United Kingdom, the Netherlands, and rest of Europe. The company operates through Imaging IT Solutions, Secure Communications, and Business Innovation segments. The Imaging IT Solutions segment develops and sells medical IT systems and services for managing, archiving, and presenting various types of medical images and patient information, as well as for operational follow-up and radiation dose monitoring; maintenance services in the form of support and system monitoring; and consulting services related to integration, system design, data migration, and business development. The Secure Communications segment develops and sells products and services for secure voice and data communications, and protection of society's sensitive IT infrastructure; and project-based development, as well as offers security and threat analyses and system monitoring services for control systems in society's critical operations. The Business Innovation segment develops and sells IT systems for planning and monitoring orthopedic surgery; and products for medical education and research projects. It serves public and private healthcare providers comprising hospitals, and hospital and private clinic chains; and government agencies, defense departments, energy companies. Sectra AB (publ) was incorporated in 1957 and is headquartered in Linköping, Sweden.","Dr. Torbjörn  Kronander MBA, Ph.D.",Healthcare,SE,1093.0,46 13 23 52 00,Teknikringen 20,Linköping,,583 30,,0.0,https://financialmodelingprep.com/image-stock/SECT-B.ST.png,2004-10-04,False,False,True,False,False
VICO.ST,18.34,0.467615,298613,1669820320,0.0,13.5-35.45,-0.08,Vicore Pharma Holding AB (publ),SEK,,SE0007577895,,Stockholm Stock Exchange,STO,Biotechnology,https://www.vicorepharma.com,"Vicore Pharma Holding AB (publ) engages in the research and development of pharmaceutical products for the treatments for rare lung diseases. The company is developing VP01, a small molecule compound for oral administration that is in phase II clinical trial for the treatment of interstitial lung diseases, idiopathic pulmonary fibrosis (IPF), systemic sclerosis, and COVID-19; and VP02, a formulation and delivery route for an existing immunomodulatory compound, which is preclinical trials to treat patients with IPF. It has a cooperation and development agreement with Emeriti Bio AB; license agreement with Nanologica AB (publ); and a collaboration agreement with Alex Therapeutics AB for the development and clinical validation of a digital therapeutic (DTx) built on the Alex DTx platform. The company was formerly known as Mintage Scientific AB. Vicore Pharma Holding AB (publ) was founded in 2000 and is headquartered in Gothenburg, Sweden.","Dr. Carl-Johan  Dalsgaard M.D., Ph.D.",Healthcare,SE,25.0,46 3 17 88 05 60,Kronhusgatan 11,Gothenburg,,411 05,,0.0,https://financialmodelingprep.com/image-stock/VICO.ST.png,2015-12-10,False,False,True,False,False
CRED-A.ST,71.9,1.022837,79092,9761288016,1.4,59.6-99.65,-1.25,Creades AB,SEK,,SE0015661236,,Stockholm Stock Exchange,STO,Asset Management,https://www.creades.se,"Creades AB is a private equity and venture capital investment firm specializing in seed/startup, early, mid & late venture, emerging growth, middle market, growth capital and buyout investments. The firm typically invests in small and medium-sized public and private companies. It focuses on Swedish companies. The firm seeks to invest between SEK100 ($15.51 million) and  SEK300 million ($46.53 million). The firm prefers to take a majority stake and seat on the board of directors of its portfolio companies. The firm uses personal and balance sheet capital for making investments. Creades AB was founded in 2011 and is based in Stockholm, Sweden.",Mr. John  Hedberg,Financial Services,SE,7.0,46 8 41 20 11 00,Ingmar Bergmans gata 4,Stockholm,,10216,,0.0,https://financialmodelingprep.com/image-stock/CRED-A.ST.png,2012-02-22,False,False,True,False,False
