Symbol,Price,Beta,VolAvg,MktCap,LastDiv,Range,Changes,companyName,currency,cik,isin,cusip,exchange,exchangeShortName,industry,website,description,CEO,sector,country,fullTimeEmployees,phone,address,city,state,zip,DCF_diff,DCF,image,ipoDate,defaultImage,isEtf,isActivelyTrading,isFund,isAdr
GMAB.CO,2762.0,0.647697,79439,180289550000,0.0,2379.0-3327.0,-25.0,Genmab A/S,DKK,,DK0010272202,,Copenhagen,CPH,Biotechnology,https://www.genmab.com,"Genmab A/S develops antibody therapeutics for the treatment of cancer and other diseases primarily in Denmark. The company markets DARZALEX, a human monoclonal antibody for the treatment of patients with multiple myeloma (MM); teprotumumab for the treatment of thyroid eye disease; ofatumurnab, a human monoclonal antibody to treat chronic lymphocytic leukemia (CLL) and multiple sclerosis; and Amivantamab for advanced or metastatic gastric or esophageal cancer and NSCLC. Its products include daratumumab to treat MM, non-MM blood cancers, and AL amyloidosis; GEN1047; tisotumab vedotin for treating cervical, ovarian, and solid cancers; DuoBody-PD-L1x4-1BB, and DuoBody-CD40x4-1BB for treating solid tumors; Epcoritamab for relapsed/refractory diffuse large B-cell lymphoma and chronic lymphocytic leukemia; and HexaBody-CD38 and DuoHexaBody-CD37 for treating hematological malignancies. The company also develops Teclistamab, which is in Phase 2 trial for vaso-occlusive crises; Camidanlumab tesirine to treat hodgkin lymphoma and solid tumors; JNJ-64007957 and JNJ-64407564 to treat MM; PRV-015 for treating celiac disease; Mim8 for treating haemophilia A; and Lu AF82422 for treating multiple system atrophy disease. In addition, it has approximately 20 active pre-clinical programs. The company has a commercial license and collaboration agreement with Seagen Inc. to co-develop tisotumab vedotin. It also has a collaboration agreement with CureVac AG for the research and development of differentiated mRNA-based antibody products; argenx to discover, develop, and commercialize novel therapeutic antibodies with applications in immunology and oncology; and AbbVie for the development of epcoritamab, as well as collaborations with BioNTech, Janssen, Novo Nordisk A/S, BliNK Biomedical SAS, and Bolt Biotherapeutics, Inc. Genmab A/S was founded in 1999 and is headquartered in Copenhagen, Denmark.",Dr. Jan G.J. van de Winkel Ph.D.,Healthcare,DK,1846.0,45 70 20 27 28,Kalvebod Brygge 43,Copenhagen,,1560,,0.0,https://financialmodelingprep.com/image-stock/GMAB.CO.png,2000-10-20,False,False,True,False,False
CHEMM.CO,451.4,1.272931,62258,7855488500,22.0,338.2-918.5,-3.2,ChemoMetec A/S,DKK,,,,Copenhagen,CPH,Medical Devices,https://chemometec.com,"ChemoMetec A/S engages in the development, production, and sale of analytical equipment for cell counting and analysis the United States, Canada, Europe, and internationally. The company offers its solutions in are areas of cell-based therapy, cancer, and stem cell research, development, and manufacturing of pharmaceuticals as well as production and quality control of animal semen and beer. Its products include NucleoCounter NC-3000, an advanced image cytometer; NucleoCounter NC-250, an automated cell analyzer; NucleoCounter NC-202, a consistent cell counter; NucleoCounter NC-200, an automated cell counter that provides solution for cell counting and cell viability determination; NucleoCounter SP-100, an automated sperm cell counter for use in animal production; NucleoCounter SCC-100, a somatic cell counter used to measure the number of somatic cells in a milk sample; and NucleoCounter YC-100, an automated yeast cell counter used to measure the total cell count and viability of yeast cells in suspension. It also provides consumables comprising cassettes, reagents, and slides; accessories, which include cables, power supplies, software, and labware products, as well as service and validation plans. The company was incorporated in 1997 and is headquartered in Allerød, Denmark.",Mr. Hans Martin Glensbjerg,Healthcare,DK,162.0,45 48 13 10 20,Gydevang 43,Allerød,,3450,,0.0,https://financialmodelingprep.com/image-stock/CHEMM.CO.png,2006-12-18,False,False,True,False,False
NDA-DK.CO,76.27,0.870086,783558,272507374761,5.96,62.47-90.5,-0.35,Nordea Bank Abp,DKK,,,,Copenhagen,CPH,Banks—Regional,https://www.nordea.com,"Nordea Bank Abp offers banking products and services in Sweden, Finland, Norway, Denmark, and internationally. It operates through Personal Banking, Business Banking, Large Corporates and Institutions, and Asset and Wealth Management segments. The Personal Banking segment provides various financial services to household customers through mobile banking, over the phone, online meetings, and branch offices. The Business Banking segment offers payments, cash management, cards, working capital management, and finance solutions to corporate and personal customers. The Large Corporates and Institutions segment provides financing, cash management and payment, investment banking, and securities services, as well as capital market products and securities to corporate and institutional customers. The Asset and Wealth Management segment offers investment, savings, and risk management solutions to high net worth individuals and institutional investors. This segment also offers private banking, life and pensions products, and asset management services. Nordea Bank Abp was founded in 1820 and is headquartered in Helsinki, Finland.",Mr. Frank  Vang-Jensen,Financial Services,FI,28268.0,358 2007 0000,Satamaradankatu 5,Helsinki,,00020,,0.0,https://financialmodelingprep.com/image-stock/NDA-DK.CO.png,2000-04-19,False,False,True,False,False
BRICK-B.ST,3.4,0.0,3435,33554668,0.0,1.945-11.38,-0.05,Bricknode Holding AB (publ),SEK,,SE0016288591,,Stockholm Stock Exchange,STO,Software—Infrastructure,https://www.bricknode.com,"Bricknode Holding AB (publ) operates as a B2B-focused SaaS company. The company provides cloud-based software that enables financial companies to launch digital banking products. It offers solutions, such as Bricknode Core, an operating system of Bricknode Financial Systems; Bricknode Broker, a solution for brokers and portfolio managers; Bricknode Lending solution for lending business; Bricknode Deposits and Savings; and Bricknode Marketplace. The company also provides brokerage as a service for automated investing in funds, stocks, bonds, currencies, and others; and lending as a service, a plug and play solution for IT infrastructure and operations. Bricknode Holding AB (publ) was founded in 2010 and is based in Skövde, Sweden.",Mr. Stefan  Willebrand,Technology,SE,23.0,46 8 12 20 86 80,Lögegatan 11,Skövde,,541 30,,0.0,https://financialmodelingprep.com/image-stock/BRICK-B.ST.png,2021-11-09,False,False,True,False,False
KNEBV.HE,46.07,0.632721,529352,23829107576,1.75,36.72-53.34,-0.57,KONE Oyj,EUR,,,,Helsinki,HEL,Specialty Industrial Machinery,https://www.kone.com,"KONE Oyj, together with its subsidiaries, engages in the elevator and escalator business worldwide. It offers elevators, escalators, and automatic building doors. The company also provides maintenance services; modernization solutions; and various residential solutions. In addition, it offers KONE Office Flow, a connected solution that allows for personalized user experiences and touch-free access; health and well-being solutions for elevators, escalators, and doors; KONE Residential Flow, a smarter building solution for the movement of people, goods, and information; KONE Access, an access control system, which is integrated with elevator system and building doors; KONE Destination, a destination control system that reduce waiting and travel times; KONE infotainment, a communication channel for building tenants and visitors; and monitoring solutions that enable real-time inspection of elevators and escalators. Further, the company provides people flow planning and consulting services; and solutions for special buildings and large projects. KONE Oyj was founded in 1908 and is based in Espoo, Finland.",Mr. Henrik  Ehrnrooth M.Sc. (Econ),Industrials,FI,63277.0,358 204 751,Keilasatama 3,Espoo,,02150,,0.0,https://financialmodelingprep.com/image-stock/KNEBV.HE.png,2005-06-01,False,False,True,False,False
ERIC-B.ST,53.26,0.274803,7986207,178861982627,2.7,49.785-81.32,0.37,Telefonaktiebolaget LM Ericsson (publ),SEK,,,,Stockholm Stock Exchange,STO,Communication Equipment,https://www.ericsson.com,"Telefonaktiebolaget LM Ericsson (publ), together with its subsidiaries, provides communication infrastructure, services, and software solutions to the telecom and other sectors. It operates through four segments: Networks, Digital Services, Managed Services, and Emerging Business and Other. The Networks segment offers radio access network solutions for various network spectrum bands, including integrated high-performing hardware and software. This segment also provides integrated antenna and transport solutions; and a range of service portfolio covering network deployment and support. The Digital Services segment offers software-based solutions for business support systems, operational support systems, communication services, core networks, and cloud infrastructure. The Managed Services segment provides networks and IT managed, network design and optimization, and application development and maintenance services to telecom operators. The Emerging Business and Other segment includes emerging businesses comprising Internet of Things; iconectiv; Cradlepoint that offers wireless edge WAN 4G and 5G enterprise solutions; and Red Bee Media, MediaKind, and other new businesses. It operates in North America, Europe and Latin America, the Middle East and Africa, South East Asia, Oceania, India, North East Asia, and internationally. Telefonaktiebolaget LM Ericsson (publ) was founded in 1876 and is headquartered in Stockholm, Sweden.","Mr. E. Borje Ekholm MBA, MSc",Technology,SE,103890.0,46 1 07 19 00 00,Torshamnsgatan 21,Stockholm,,164 83,,0.0,https://financialmodelingprep.com/image-stock/ERIC-B.ST.png,2000-01-03,False,False,True,False,False
FNOX.ST,64.66,1.308498,908631,39426113252,0.12,39.56-78.12,0.02,Fortnox AB (publ),SEK,,SE0017161243,,Stockholm Stock Exchange,STO,Software—Application,https://www.fortnox.se,"Fortnox AB (publ) operates a cloud-based platform for financial administration for small businesses, accounting firms, associations, and schools. It offers various programs and services for accounting, billing, quotation and order, stocks, salary, receipt and travel, direct debit, plant registry, supplier certificate and read, school support, time, invoice interpretation, credit information, e-invoice, invoice service, and invoice purchases. The company also provides insurance services. Fortnox AB (publ) was founded in 1993 and is headquartered in Växjö, Sweden.",Mr. Tommy  Eklund,Technology,SE,623.0,46 4 70 78 50 00,Bollgatan 3B,Växjö,,352 46,,0.0,https://financialmodelingprep.com/image-stock/FNOX.ST.png,2012-09-06,False,False,True,False,False
HM-B.ST,173.14,1.324223,2790006,282164522445,6.5,98.2-189.58,-3.66,H & M Hennes & Mauritz AB (publ),SEK,,,,Stockholm Stock Exchange,STO,Apparel Manufacturing,https://www.hmgroup.com,"H & M Hennes & Mauritz AB (publ) provides clothing, accessories, footwear, cosmetics, home textiles, and homeware for women, men, teenagers, children, and babies worldwide. It offers sportswear, shoes, bags, beauty products, and ready-to-wear; and interior products, including bed linens, dinnerware, textiles, furniture, and lighting. The company provides its products under the H&M, H&M HOME, COS, & Other Stories, Monki, Weekday, ARKET, Afound, Singular Society, Treadler, Creator Studio, and Sellpy brands. As of November 30, 2021, the company had 54 online markets and approximately 4,801 stores in 75 markets, including franchise markets. H & M Hennes & Mauritz AB (publ) was founded in 1947 and is headquartered in Stockholm, Sweden.",Ms. Helena  Helmersson,Consumer Cyclical,SE,150000.0,46 87 96 55 00,MAester Samuelsgatan 46A,Stockholm,,106 38,,0.0,https://financialmodelingprep.com/image-stock/HM-B.ST.png,2000-01-03,False,False,True,False,False
ATCO-B.ST,130.2,0.940097,1641478,701831366636,2.3,89.48-140.95,0.25,Atlas Copco AB,SEK,,,,Stockholm Stock Exchange,STO,Specialty Industrial Machinery,https://www.atlascopcogroup.com,"Atlas Copco AB, together with its subsidiaries, provides productivity solutions. The company operates through Compressor Technique, Vacuum Technique, Industrial Technique, and Power Technique segments. It offers piston compressors, oil-free tooth and scroll compressors, rotary screw compressors, oil-free blowers, oil-free centrifugal compressors, gas and process compressors, air and gas treatment equipment, and medical air solutions primarily for use in the manufacturing and process industries. The company also provides oil-sealed rotary vane, dry, and liquid ring vacuum pumps; and turbomolecular and cryogenic pumps, as well as abatement and integrated systems for the semiconductor and scientific, chemical process, food packaging, and paper handling industries. In addition, it offers pneumatic, hydraulic, and electric assembly tools, as well as control systems and associated software for safety-critical tightening; self-pierce riveting tools, dispensing equipment for adhesives and sealants, and flow drill fastening equipment; material removal tools, drills, and other pneumatic products; and machine vision solutions for customers in the automotive and general industries. Further, the company provides portable compressors, boosters, generators, lighting towers, pumps, and construction and demolition tools for civil engineering, oil and gas, construction, manufacturing, exploration drilling, and demolition industries, as well as specialty rental services. It operates in North America, South America, Europe, Africa, the Middle East, Asia, and Oceania. The company was founded in 1873 and is headquartered in Nacka, Sweden.",Mr. Mats  Rahmström,Industrials,SE,48951.0,46 87 43 80 00,Sickla Industriväg 19,Nacka,,13154,,0.0,https://financialmodelingprep.com/image-stock/ATCO-B.ST.png,1999-12-01,False,False,True,False,False
BRAV.ST,83.65,0.93785,191601,17069701981,3.25,81.9-128.0,-0.95,Bravida Holding AB (publ),SEK,,,,Stockholm Stock Exchange,STO,Engineering & Construction,https://www.bravida.se,"Bravida Holding AB (publ) provides technical services and installations for buildings and industrial facilities in Sweden, Norway, Denmark, and Finland. The company offers installation and refurbishment of technical systems in properties, facilities, and infrastructure; and operation and maintenance services, as well as undertakes minor refurbishment works. It also provides installation services for electrical, heating and plumbing, and technical solutions, as well as heating, ventilation, and air conditioning systems in buildings and facilities; and installs and services cooling and power facilities, and solar panels. In addition, it provides telecom and other low-voltage installations; fire and intruder alarm products and systems; access control systems; CCTV; and integrated security systems, as well as electric-car charging; energy optimization; and GreenHub fossil-free transport services. Further, the company offers technical management of properties and facilities services. It serves property owners, professional tenants, and industrial companies. The company was founded in 1922 and is headquartered in Stockholm, Sweden.",Mr. Mattias  Johansson,Industrials,SE,13000.0,46 86 95 20 00,MikrofonvAegen 28,Stockholm,,126 81,,0.0,https://financialmodelingprep.com/image-stock/BRAV.ST.png,2015-10-16,False,False,True,False,False
ABB.ST,420.1,0.991014,651768,780907099443,9.46,269.1-429.7,-1.1,ABB Ltd,SEK,,,,Stockholm Stock Exchange,STO,Electrical Equipment & Parts,https://www.global.abb/group/en,"ABB Ltd engages in manufacture and sale of electrification, automation, robotics, and motion products for customers in utilities, industry and transport, and infrastructure in Switzerland and internationally. Its Electrification segment provides electric vehicle charging infrastructure, renewable power solutions, modular substation packages, distribution automation products, switchboard and panelboards, switchgear, UPS solutions, circuit breakers, measuring and sensing devices, control products, wiring accessories, enclosures and cabling systems, and intelligent home and building solutions. The company's Robotics & Discrete Automation segment offers industrial robots, software, robotic solutions and systems, field services, spare parts, and digital services. This segment also offers solutions based on its programmable logic controllers, industrial PCs, servo motion, transport system, and machine vision. Its Motion segment manufactures and sells drives, motors, generators, traction converters, and mechanical power transmission products that are driving the low-carbon future for industries, cities, infrastructure, and transportation. The company's Process Automation segment provides process and discrete control technologies, advanced process control software and manufacturing execution systems, sensing, measurement and analytical instrumentation, marine propulsion systems, and large turbochargers. In addition, this segment offers remote monitoring, preventive maintenance, asset performance management, emission monitoring, and cybersecurity services. It serves aluminum, automotive, buildings and infrastructure, cement, channel partners, chemical, data centers, food and beverage, process automation, life sciences, marine and ports, metals, mining, oil and gas, ports, power generation, printing, pulp and paper, railway, smart cities, water, and wind power industries. The company was founded in 1883 and is headquartered in Zurich, Switzerland.",Mr. Bjorn Klas Otto Rosengren,Industrials,CH,105100.0,41 43 317 71 11,Affolternstrasse 44,Zurich,,8050,,0.0,https://financialmodelingprep.com/image-stock/ABB.ST.png,2001-05-08,False,False,True,False,False
NDA-SE.ST,118.98,0.870086,4321622,425107217111,9.01,91.51-134.94,-0.1,Nordea Bank Abp,SEK,,FI4000297767,,Stockholm Stock Exchange,STO,Banks—Regional,https://www.nordea.com,"Nordea Bank Abp offers banking products and services in Sweden, Finland, Norway, Denmark, and internationally. It operates through Personal Banking, Business Banking, Large Corporates and Institutions, and Asset and Wealth Management segments. The Personal Banking segment provides various financial services to household customers through internet and mobile banking, over the phone, online meetings, and branch offices. The Business Banking segment offers payments, cash management, cards, working capital management, and finance solutions to corporate and personal customers. The Large Corporates and Institutions segment provides financing, cash management and payment, investment banking, and securities services, as well as capital market products to corporate and institutional customers. The Asset and Wealth Management segment offers investment, savings, and risk management solutions to high net worth individuals and institutional investors. This segment also offers life and pensions products and services. The company was founded in 1820 and is headquartered in Helsinki, Finland.",Mr. Frank  Vang-Jensen,Financial Services,FI,28268.0,358 2007 0000,Satamaradankatu 5,Helsinki,,00020,,0.0,https://financialmodelingprep.com/image-stock/NDA-SE.ST.png,2000-01-03,False,False,True,False,False
DANSKE.CO,159.45,0.988019,1529001,136932149549,7.0,86.84-170.8,-1.4,Danske Bank A/S,DKK,,DK0010274414,,Copenhagen,CPH,Banks—Regional,https://danskebank.com,"Danske Bank A/S provides various banking products and services to corporate, institutional, and international clients. The company offers insurance and pension products, mortgage finance and real-estate brokerage services, asset management and trading services in fixed income products, foreign exchange services, and equities. It also provides advisory services to personal and private banking customers; and business advisory services, including acquisition, change of ownership, strategic development, or international expansion. In addition, the company offers financing, risk management, investment, and financial advisory services for large corporates and institutions; healthcare solutions; and online and mobile banking services. It has operations in Denmark, Finland, Sweden, Norway, the United Kingdom, and internationally. The company was founded in 1871 and is headquartered in Copenhagen, Denmark.",Mr. Carsten Rasch Egeriis,Financial Services,DK,21022.0,45 33 44 00 00,Holmens Kanal 2-12,Copenhagen,,1092,,0.0,https://financialmodelingprep.com/image-stock/DANSKE.CO.png,2000-11-08,False,False,True,False,False
DSV.CO,1349.0,1.040059,327779,287817244000,6.5,858.4-1496.5,-8.0,DSV A/S,DKK,,DK0060079531,,Copenhagen,CPH,Integrated Freight & Logistics,https://www.dsv.com,"DSV A/S offers transport and logistics services in Europe, the Middle East, Africa, North America, South America, Asia, Australia, and the Pacific. It operates through three segments: Air & Sea, Road, and Solutions. The company provides air freight, air freight compliance and carrier, and rail freight services; sea freight, and sea freight compliance and carrier services, as well as freight containers. It also offers road freight services, such as part and full loads, groupage, specialized transport, express, and online and document handling services; and workshops. In addition, the company provides logistics solutions for automotive, consumer products, healthcare, high-tech, and industrial sectors; and inventory management solutions. Further, it offers special project transport services, such as industrial projects, renewable energy, government logistics, ship charter, and air charter services; and courier and warehousing services. The company was formerly known as DSV Panalpina A/S and changed its name to DSV A/S in September 2021. DSV A/S was incorporated in 1976 and is based in Hedehusene, Denmark.",Mr. Jens Bjorn Andersen,Industrials,DK,74613.0,45 43 20 30 40,Hovedgaden 630,Hedehusene,,2640,,0.0,https://financialmodelingprep.com/image-stock/DSV.CO.png,2000-01-21,False,False,True,False,False
INDU-C.ST,298.2,0.845376,405053,129035314204,7.25,214.2-305.7,0.1,AB Industrivärden (publ),SEK,,SE0000107203,,Stockholm Stock Exchange,STO,Asset Management,https://www.industrivarden.se/en-GB,"AB Industrivärden is a publicly owned investment manager. The firm invests in the public equity markets of Nordic region. It employs fundamental analysis, with a focus on factors like long term return potential, proven business model, balance between risk and return, and attractive valuation to create its portfolio. AB Industrivärden was founded in 1944 and is based in Stockholm, Sweden.",Ms. Helena  Stjernholm,Financial Services,SE,15.0,46 86 66 64 00,Storgatan 10,Stockholm,,114 51,,0.0,https://financialmodelingprep.com/image-stock/INDU-C.ST.png,2000-01-03,False,False,True,False,False
SHB-A.ST,92.42,0.625233,5207514,179736570557,5.5,83.92-112.9,0.02,Svenska Handelsbanken AB (publ),SEK,,SE0007100599,,Stockholm Stock Exchange,STO,Banks—Diversified,https://www.handelsbanken.se,"Svenska Handelsbanken AB (publ) provides various banking products and services for private and corporate customers primarily in Sweden, the United Kingdom, Norway, the Netherlands, the United States, Luxembourg, China, Germany, France, and Poland. The company offers savings, transactions, business, currency, and investment accounts, as well as accounts for cash pool, and forestry and agriculture; mortgage and committed loans, and private loans; mutual funds; pension products; credit and debit cards; and payment and reconciliation services. It also provides financing for investments, such as equipment, cars, computers, and other inventories, as well as vehicle and real estate financing services; green loans and advisor services; investment and other financing services; medical care, group and health, and travel insurance products; forestry and farming banking products; and online and mobile banking services. In addition, the company offers transaction, trade finance, cash management, risk management, and foreign exchange services, as well as various banking services for children and young people. It operates approximately 214 branches in Sweden, 196 in the Great Britain, 41 in Norway, 42 in Denmark, 27 in Finland, and 28 in the Netherlands. Svenska Handelsbanken AB (publ) was incorporated in 1871 and is headquartered in Stockholm, Sweden.",Mr. Carl  Cederschiold,Financial Services,SE,10172.0,46 87 01 10 00,Kungsträdgårdsgatan 2,Stockholm,,106 70,,0.0,https://financialmodelingprep.com/image-stock/SHB-A.ST.png,2000-01-03,False,False,True,False,False
NETI-B.ST,4.468,0.281542,926551,1582190288,0.0,4.07-7.39,-0.048,Net Insight AB (publ),SEK,,,,Stockholm Stock Exchange,STO,Communication Equipment,https://www.netinsight.net,"Net Insight AB (publ) offers media network solutions worldwide. It offers professional media transport solutions, including remote production, customer provisioned networks, live contribution, internet media transport, ATSC 3.0 transport, cloud ingest, and affiliate interconnect and distribution under the Nimbra name, as well as live IP media function virtualization solutions under the Aperi name. The company also provides support, training, and professional services. It sells its products and services through its sales force and network partner. The company serves broadcasters, enterprises, service providers, content owners, and production companies. Net Insight AB (publ) was founded in 1997 and is headquartered in Solna, Sweden.",Mr. Crister  Fritzson,Technology,SE,131.0,46 86 85 04 00,P.O. Box 1200,Solna,,171 23,,0.0,https://financialmodelingprep.com/image-stock/NETI-B.ST.png,2000-01-03,False,False,True,False,False
